[
  {
    "domain": "agentpki.org",
    "manifest": "https://agentpki.org/.well-known/ai.json",
    "jwks_uri": "https://agentpki.org/.well-known/jwks.json",
    "servers": [
      {
        "type": "rest",
        "url": "https://agentpki.org"
      }
    ],
    "capabilities": [
      "schemas.list",
      "urn:agent:skill:agentpki.org:reference.v1"
    ],
    "status": "active"
  },
  {
    "domain": "agenturn.org",
    "manifest": "https://agenturn.org/.well-known/ai.json",
    "jwks_uri": "https://agenturn.org/.well-known/jwks.json",
    "servers": [
      {
        "type": "rest",
        "url": "https://agenturn.org"
      }
    ],
    "capabilities": [
      "schemas.list",
      "urn:agent:skill:agenturn.org:reference.v1"
    ],
    "status": "active"
  },
  {
    "domain": "ai-manifest.org",
    "manifest": "https://ai-manifest.org/.well-known/ai.json",
    "jwks_uri": "https://ai-manifest.org/.well-known/jwks.json",
    "servers": [
      {
        "type": "rest",
        "url": "https://ai-manifest.org"
      }
    ],
    "capabilities": [
      "schemas.list",
      "urn:agent:skill:ai-manifest.org:reference.v1"
    ],
    "status": "active"
  },
  {
    "domain": "viggisfoodtrucks.com",
    "manifest": "https://viggisfoodtrucks.com/.well-known/ai.json",
    "jwks_uri": "https://viggisfoodtrucks.com/.well-known/jwks.json",
    "servers": [
      {
        "type": "rest",
        "url": "https://viggisfoodtrucks.com"
      }
    ],
    "capabilities": [
      "agent_apply",
      "urn:agent:skill:viggisfoodtrucks.com:philobot-apply.v1"
    ],
    "status": "inactive"
  },
  {
    "domain": "wellknownai.org",
    "manifest": "https://wellknownai.org/.well-known/ai.json",
    "jwks_uri": "https://wellknownai.org/.well-known/jwks.json",
    "servers": [
      {
        "type": "rest",
        "url": "https://wellknownai.org"
      }
    ],
    "capabilities": [
      "schemas.list",
      "urn:agent:skill:wellknownai.org:reference.v1"
    ],
    "status": "active"
  }
]
